{
  "schemaVersion": "1.0.0",
  "receiptId": "ts_prop_abc123456789_12345678",
  "sourceProjectId": "prj_abc123456789",
  "sourceProjectSlug": "demo-projeto",
  "proposalId": "prop_abc123456789",
  "proposalHash": "1234567890abcdef",
  "studioProjectId": "mp_studio123456789",
  "campaignId": "camp_abc123456789",
  "briefRevision": 1,
  "campaignRevision": 1,
  "panelHash": "panelhash1234567890",
  "angleHashes": ["a1111111", "b2222222"],
  "readbackOk": true,
  "deepLink": "http://127.0.0.1:5177/projects/demo-projeto/campaigns/camp_abc123456789",
  "syncedAt": "2026-07-23T02:00:00.000Z"
}
